title,company,url,category,platform,date_posted,description,tags,estimated_rate
Automation Specialist n8n Zapier Make,Flexer,https://www.freelancer.com/projects/data-integration/automation-specialist-for-make-com,automation,freelancer,2025-04,"Design, build, and optimize automation scripts and workflows using n8n, Zapier, Make. Troubleshoot existing automations. Integrate various apps, APIs, and services.",n8n Zapier Make API,200-250 INR/hour
Freelance n8n Developer,Italian Startup,https://community.n8n.io/t/looking-for-a-freelance-n8n-automation-developer/224090,automation,n8n Community,2025-11,"Prestashop website automation with WhatsApp, Telegram, DocuSign integrations. E-Commerce workflow streamlining.",n8n PHP Prestashop WhatsApp API,n8n certified,negotiable
AI Automation Specialist,Henro AI Studio,https://flexionis.wuaze.com/job/ai-automation-specialist-make-com-expert-n8n-zapier-workflow-for-ai-video-creator,automation,Flexionis,2026-03,"Build AI automation workflow for AI video creation. Integrate Sora 2, Veo3, Kling, Heygen. Airtable metadata storage. CRM notifications.",Make n8n Zapier AI Video,10-15 USD (test task)
n8n Make Workflow Developer,OnlineJobs.ph,https://www.onlinejobs.ph/jobseekers/job/n8n-Makecom-Workflow-Developer-1459427,automation,OnlineJobs.ph,2026-03,"Design complex workflows in n8n/Make. Integrate APIs, webhooks, CRMs. Debug and optimize. Custom nodes/modules. Error handling.",n8n Make API CRM JavaScript,competitive
Automation Workflow Developer,InfinitySales.ai,https://wuzzuf.net/jobs/p/dnqlob931x79-automation-workflow-developer-n8n-zapier-make-remote-full-time-richmond-united-states,automation,Wuzzuf,2025,"Implement AI automation systems for sales, operations, workflow optimization. Design, build, test automations using n8n, Make, Zapier. API/webhooks integration.",n8n Make Zapier REST API,600-900 USD/month
AI Automation Specialist German,Various German Companies,https://www.growthroles.com/jobs/freelancer-im-bereich-ki-automation-u-a-in-marketing-sales-e-commerce-it-b2b-prozesse-n8n-make-zapier-uipath-python-feeab491,automation,GrowthRoles,2025-04,"KI & Automation in Marketing, Sales, E-Commerce, IT, B2B Prozesse. Implementation of automation solutions. Consulting. German required.",n8n Make Zapier UiPath Python German,mid-senior level
Automation Expert n8n Make,n8n Job Feed,https://n8ndevs.com/jobs/BPugcp1bS6CbFeuAMWDq9w,automation,n8n,2025,"Fine-tune automations. Connect Make.com, Airtable, Pinecone. Optimize processes. Part-time project-based.",n8n Make.com Airtable Pinecone,2-8 USD/hour